<?xml version="1.0" encoding="UTF-8" standalone="no"?><Clienten xmlns:xsi="http://www.w3.org/2001/XMLSchema-instance" xsi:noNamespaceSchemaLocation="ClientFormat.xsd">

	<Client BSN="125651201">
		<ClientGegevens>
			<Naam>Xander Gerreman</Naam>
			<Adres>Marialaan 9a</Adres>
			<Postcode>4834VG</Postcode>
			<Woonplaats>Breda</Woonplaats>
			<Geboortedatum>10-06-1994</Geboortedatum>
			<Telefoonnummer>0682739024</Telefoonnummer>
			<Email>xpjgerre@avans.nl</Email>
			<BetaalMethode>incasso</BetaalMethode>
			<ResterendEigenRisico>0.0</ResterendEigenRisico>
			<Rekeningnummer>NL47RABO0136052159</Rekeningnummer>
		</ClientGegevens>
		<VerzekeringPolissen>
			<VerzekeringPolis PolisNummer="87JH9G">
				<VerzekeringType>Kaas_Basic</VerzekeringType>
				<EigenRisico>200.0</EigenRisico>
				<startDatum>01-01-2013</startDatum>
				<eindDatum>31-12-2013</eindDatum>
			</VerzekeringPolis>
		
			<VerzekeringPolis PolisNummer="BDVJLX">
				<VerzekeringType>Kaas_Basic</VerzekeringType>
				<EigenRisico>250.0</EigenRisico>
				<startDatum>10-06-2001</startDatum>
				<eindDatum>10-06-2002</eindDatum>
			</VerzekeringPolis></VerzekeringPolissen>
		<Facturen><Factuur FactuurNummer="1"><FactuurDatum>05-11-2014</FactuurDatum><VervalDatum>19-11-2014</VervalDatum><FactuurBehandelingen><FactuurBehandeling BehandelingID="12"><BehandelafspraakID>1847</BehandelafspraakID></FactuurBehandeling></FactuurBehandelingen><TevergoedenBedrag>150.0</TevergoedenBedrag><Status>Niet betaald</Status><Totaalprijs>0.0</Totaalprijs></Factuur></Facturen>
	</Client>
	<Client BSN="125651202">
		<ClientGegevens>
			<Naam>Sander Blijlevens</Naam>
			<Adres>Schijfstraat 26B</Adres>
			<Postcode>4847SM</Postcode>
			<Woonplaats>Breda</Woonplaats>
			<Geboortedatum>31-12-1995</Geboortedatum>
			<Telefoonnummer>0625235100</Telefoonnummer>
			<Email>sjmblijl@avans.nl</Email>
			<BetaalMethode>incasso</BetaalMethode>
			<ResterendEigenRisico>0.0</ResterendEigenRisico>
			<Rekeningnummer>NL47RABO0136052185</Rekeningnummer>
		</ClientGegevens>
		<VerzekeringPolissen>
			<VerzekeringPolis PolisNummer="KJ8JUY">
				<VerzekeringType>Kaas_Basic</VerzekeringType>
				<EigenRisico>200.0</EigenRisico>
				<startDatum>01-01-2013</startDatum>
				<eindDatum>31-12-2013</eindDatum>
			</VerzekeringPolis>
			<VerzekeringPolis PolisNummer="123456">
				<VerzekeringType>Kaas_Basic</VerzekeringType>
				<EigenRisico>1125.48</EigenRisico>
				<startDatum>01-01-2010</startDatum>
				<eindDatum>31-12-2011</eindDatum>
			</VerzekeringPolis>
			<VerzekeringPolis PolisNummer="BJOWB2">
				<VerzekeringType>Kaas_All-risk</VerzekeringType>
				<EigenRisico>250.0</EigenRisico>
				<startDatum>01-01-2015</startDatum>
				<eindDatum>01-01-2016</eindDatum>
			</VerzekeringPolis>
			<VerzekeringPolis PolisNummer="0GUNC4">
				<VerzekeringType>Kaas_All-risk</VerzekeringType>
				<EigenRisico>250.0</EigenRisico>
				<startDatum>03-11-2014</startDatum>
				<eindDatum>05-12-2015</eindDatum>
			</VerzekeringPolis></VerzekeringPolissen>
		<Facturen/>
	</Client>
</Clienten>